{
  "$schema": "./platform.schema.json",
  "schemaVersion": 1,
  "description": "PredixLab workload definitions shared by Azure Bicep (azure/) and the local Apple container staging environment (local/). Values are production facts unless an entry uses per-environment \"values\" or a deployment \"parameter\" (supplied at deployment time, never committed).",
  "registry": "predixlabacr.azurecr.io",
  "databaseName": "predixlab",
  "endpoints": {
    "prod": {
      "api": "https://api.predixlab.com",
      "dashboard": "https://dashboard.predixlab.com",
      "portal": "https://predixlab.com"
    },
    "local": {
      "api": "http://localhost:8000",
      "dashboard": "http://localhost:3000",
      "portal": "http://localhost:8080"
    }
  },
  "sharedStorage": {
    "shareName": "predixlab-data",
    "quotaGiB": 102400,
    "mountPath": "/data"
  },
  "queues": [
    "campaign-events",
    "campaign-delivery"
  ],
  "images": {
    "api": {
      "repository": "predixlab-api",
      "tagPolicy": "live",
      "defaultTag": "latest",
      "source": {
        "repo": "predixlab-api",
        "dockerfile": "Dockerfile"
      }
    },
    "collector": {
      "repository": "qstock-collector",
      "tagPolicy": "fixed",
      "defaultTag": "latest",
      "source": {
        "repo": "predixlab-collector",
        "dockerfile": "Dockerfile"
      }
    },
    "signals": {
      "repository": "predixlab-signals",
      "tagPolicy": "live",
      "defaultTag": "latest",
      "source": {
        "repo": "predixlab-signals",
        "dockerfile": "Dockerfile"
      }
    },
    "options": {
      "repository": "qstock-options",
      "tagPolicy": "fixed",
      "defaultTag": "latest",
      "source": {
        "repo": "predixlab-options",
        "dockerfile": "Dockerfile"
      }
    }
  },
  "secrets": {
    "mongodb-connection-string": {
      "keyVaultSecret": "predixlab-mongodb-connection-string",
      "description": "Cosmos DB for MongoDB connection string",
      "local": "mongodb"
    },
    "storage-account-connection-string": {
      "keyVaultSecret": "predixlab-storage-account-connection-string",
      "description": "Storage account connection string (campaign queues)",
      "local": "azurite"
    },
    "acs-connection-string": {
      "keyVaultSecret": "predixlab-acs-connection-string",
      "description": "Azure Communication Services connection string; empty locally disables email",
      "local": "optional"
    },
    "jwt-secret-key": {
      "keyVaultSecret": "jwt-secret-key",
      "description": "JWT signing key shared by API and campaign",
      "local": "generated"
    },
    "unsubscribe-secret": {
      "keyVaultSecret": "campaign-unsubscribe-signing-key",
      "description": "Independent unsubscribe-link signing key shared by API and campaign",
      "local": "generated"
    },
    "session-secret-key": {
      "keyVaultSecret": "session-secret-key",
      "description": "Independent API OAuth session-cookie signing key",
      "local": "generated"
    },
    "google-oauth-client-id": {
      "keyVaultSecret": "google-oauth-client-id",
      "local": "optional"
    },
    "google-oauth-client-secret": {
      "keyVaultSecret": "google-oauth-client-secret",
      "local": "optional"
    },
    "microsoft-oauth-client-id": {
      "keyVaultSecret": "microsoft-oauth-client-id",
      "local": "optional"
    },
    "microsoft-oauth-client-secret": {
      "keyVaultSecret": "microsoft-oauth-client-secret",
      "local": "optional"
    },
    "stripe-secret-key": {
      "keyVaultSecret": "stripe-secret-key",
      "description": "Use a Stripe test-mode key locally",
      "local": "optional"
    },
    "stripe-publishable-key": {
      "keyVaultSecret": "stripe-publishable-key",
      "local": "optional"
    },
    "stripe-webhook-secret": {
      "keyVaultSecret": "stripe-webhook-secret",
      "local": "optional"
    }
  },
  "parameters": {
    "alert-recipients": {
      "description": "Comma-separated recipients of the job status emails (ACS_TO_EMAILS); empty locally, so no status email is sent",
      "local": ""
    }
  },
  "containerApps": [
    {
      "name": "api",
      "azureName": "predixlab-api",
      "environment": "api",
      "identity": "api",
      "registryAuth": "adminCredentials",
      "activeRevisionsMode": "Single",
      "maxInactiveRevisions": 100,
      "ingress": {
        "external": true,
        "targetPort": 8000,
        "transport": "Auto",
        "allowInsecure": false,
        "customDomains": [
          "api.predixlab.com"
        ]
      },
      "scale": {
        "minReplicas": 1,
        "maxReplicas": 10,
        "cooldownPeriod": 300,
        "pollingInterval": 30
      },
      "additionalSecrets": [
        "storage-account-connection-string"
      ],
      "volumes": [
        {
          "name": "predixlab-data",
          "storageName": "predixlab-data-rw"
        }
      ],
      "containers": [
        {
          "name": "predixlab-api",
          "image": "api",
          "local": {
            "command": [ "/app/.venv/bin/uvicorn", "app.main:app", "--host", "0.0.0.0", "--port", "8000" ],
            "reason": "The image CMD runs `uv` from /root/.local/bin as appuser. Azure Container Apps (containerd CRI) keeps the default capabilities effective for non-root users, so the lookup succeeds there; Apple container drops them. Locally the same uvicorn from the project venv is started directly, still as appuser."
          },
          "cpu": "0.5",
          "memory": "1Gi",
          "ephemeralStorage": "2Gi",
          "volumeMounts": [
            {
              "volumeName": "predixlab-data",
              "mountPath": "/data"
            }
          ],
          "probes": [
            {
              "type": "Liveness",
              "httpGet": {
                "path": "/health",
                "port": 8000,
                "scheme": "HTTP"
              },
              "initialDelaySeconds": 0,
              "periodSeconds": 10
            },
            {
              "type": "Readiness",
              "tcpSocket": {
                "port": 8000
              },
              "initialDelaySeconds": 0,
              "periodSeconds": 5,
              "failureThreshold": 48,
              "successThreshold": 1,
              "timeoutSeconds": 5
            },
            {
              "type": "Startup",
              "tcpSocket": {
                "port": 8000
              },
              "initialDelaySeconds": 1,
              "periodSeconds": 1,
              "failureThreshold": 240,
              "successThreshold": 1,
              "timeoutSeconds": 3
            }
          ],
          "env": [
            { "name": "MONGODB_URL", "secret": "mongodb-connection-string" },
            { "name": "DATABASE_NAME", "value": "predixlab" },
            { "name": "SECRET_KEY", "secret": "jwt-secret-key" },
            { "name": "UNSUBSCRIBE_SECRET", "secret": "unsubscribe-secret" },
            { "name": "SESSION_SECRET_KEY", "secret": "session-secret-key" },
            { "name": "ALGORITHM", "value": "HS256" },
            { "name": "ACCESS_TOKEN_EXPIRE_MINUTES", "value": "30" },
            { "name": "ACS_CONNECTION_STRING", "secret": "acs-connection-string" },
            { "name": "ACS_SENDER", "value": "notification@predixlab.com" },
            { "name": "GOOGLE_CLIENT_ID", "secret": "google-oauth-client-id" },
            { "name": "GOOGLE_CLIENT_SECRET", "secret": "google-oauth-client-secret" },
            { "name": "MICROSOFT_CLIENT_ID", "secret": "microsoft-oauth-client-id" },
            { "name": "MICROSOFT_CLIENT_SECRET", "secret": "microsoft-oauth-client-secret" },
            {
              "name": "CORS_ORIGINS",
              "values": {
                "prod": "[\"https://www.predixlab.com\", \"https://dashboard.predixlab.com\", \"https://predixlab.com\"]",
                "local": "[\"http://localhost:3000\", \"http://localhost:8080\"]"
              }
            },
            {
              "name": "GOOGLE_OAUTH_CALLBACK_URL",
              "values": {
                "prod": "https://api.predixlab.com/api/v1/auth/google/callback",
                "local": "http://localhost:8000/api/v1/auth/google/callback"
              }
            },
            {
              "name": "MICROSOFT_OAUTH_CALLBACK_URL",
              "values": {
                "prod": "https://api.predixlab.com/api/v1/auth/microsoft/callback",
                "local": "http://localhost:8000/api/v1/auth/microsoft/callback"
              }
            },
            {
              "name": "OAUTH_REDIRECT_URL",
              "values": {
                "prod": "https://dashboard.predixlab.com/auth/callback",
                "local": "http://localhost:3000/auth/callback"
              }
            },
            { "name": "STRIPE_SECRET_KEY", "secret": "stripe-secret-key" },
            { "name": "STRIPE_PUBLISHABLE_KEY", "secret": "stripe-publishable-key" },
            { "name": "STRIPE_WEBHOOK_SECRET", "secret": "stripe-webhook-secret" },
            {
              "name": "STRIPE_MONTHLY_PRICE_ID",
              "values": {
                "prod": "price_1S6ok1ABVO7mgz5TU1zHDMCb",
                "local": ""
              }
            },
            {
              "name": "STRIPE_YEARLY_PRICE_ID",
              "values": {
                "prod": "price_1S6ok1ABVO7mgz5TbJcwsH4F",
                "local": ""
              }
            },
            { "name": "STRIPE_TRIAL_PERIOD_DAYS", "value": "30" },
            { "name": "PREDICTIONS_DIR", "value": "/data/predictions" },
            { "name": "PICKS_DIR", "value": "/data/picks" },
            { "name": "US_STOCK_DATA_DIR", "value": "/data/stock_data/us_data" },
            { "name": "US_CALENDAR_PATH", "value": "/data/calendar/us.txt" },
            { "name": "US_INDEX_PATH", "value": "/data/instruments/us.txt" },